{
  "$schema": "https://json-schema.org/draft/2020-12/schema",
  "$id": "https://academy.dtfseeds.com/schemas/assessment.schema.json",
  "title": "THC Academy Assessment",
  "type": "object",
  "required": ["id", "title", "version", "status", "purpose", "competencies", "objectives", "items", "passingScorePercent", "feedbackMode"],
  "properties": {
    "id": {"type": "string", "pattern": "^ASSESS-[A-Z0-9-]+$"},
    "title": {"type": "string", "minLength": 3},
    "version": {"type": "string", "pattern": "^[0-9]+\\.[0-9]+\\.[0-9]+$"},
    "status": {"enum": ["draft", "review", "approved", "published", "superseded", "retired"]},
    "purpose": {"enum": ["formative", "summative", "credential"]},
    "competencies": {"type": "array", "minItems": 1, "uniqueItems": true, "items": {"type": "string", "pattern": "^COMP-[A-Z0-9-]+$"}},
    "objectives": {"type": "array", "minItems": 1, "uniqueItems": true, "items": {"type": "string", "pattern": "^LO-[A-Z0-9-]+$"}},
    "items": {"type": "array", "uniqueItems": true, "items": {"type": "string", "pattern": "^ITEM-[A-Z0-9-]+$"}},
    "passingScorePercent": {"type": "number", "minimum": 0, "maximum": 100},
    "maxAttempts": {"type": ["integer", "null"], "minimum": 1},
    "cooldownHours": {"type": "integer", "minimum": 0},
    "timeLimitMinutes": {"type": ["integer", "null"], "minimum": 1, "maximum": 480},
    "feedbackMode": {"enum": ["immediate", "after-submit", "post-attempt-domain-level", "delayed", "none"]},
    "totalItems": {"type": "integer", "minimum": 1},
    "randomizeItems": {"type": "boolean"},
    "randomizeChoices": {"type": "boolean"},
    "blueprint": {
      "type": "array",
      "minItems": 1,
      "items": {
        "type": "object",
        "required": ["competency", "items", "cognitiveTarget"],
        "properties": {
          "competency": {"type": "string", "pattern": "^COMP-[A-Z0-9-]+$"},
          "items": {"type": "integer", "minimum": 1},
          "cognitiveTarget": {"type": "string", "minLength": 3}
        },
        "additionalProperties": false
      }
    },
    "itemPools": {
      "type": "array",
      "minItems": 1,
      "items": {
        "type": "object",
        "required": ["name", "idPrefix", "items", "cognitiveTarget"],
        "properties": {
          "name": {"type": "string", "minLength": 3},
          "idPrefix": {"type": "string", "pattern": "^ITEM-[A-Z0-9-]+-$"},
          "items": {"type": "integer", "minimum": 1},
          "cognitiveTarget": {"type": "string", "minLength": 3}
        },
        "additionalProperties": false
      }
    },
    "itemSelection": {
      "type": "object",
      "required": ["minimumActiveItemsPerCompetency", "targetBankItemsPerCompetency", "requireReferenceBackedItems", "requireHumanAssessmentReview"],
      "properties": {
        "minimumActiveItemsPerCompetency": {"type": "integer", "minimum": 1},
        "targetBankItemsPerCompetency": {"type": "integer", "minimum": 1},
        "requireReferenceBackedItems": {"type": "boolean"},
        "requireHumanAssessmentReview": {"type": "boolean"}
      },
      "additionalProperties": false
    },
    "accommodations": {
      "type": "object",
      "properties": {
        "allowExtendedTime": {"type": "boolean"},
        "allowAlternativeAccessiblePresentation": {"type": "boolean"}
      },
      "additionalProperties": false
    },
    "extensions": {"type": "object"}
  },
  "allOf": [
    {
      "if": {"anyOf": [{"required": ["blueprint"]}, {"required": ["itemPools"]}]},
      "then": {"required": ["totalItems", "itemSelection"]}
    }
  ],
  "additionalProperties": false
}
