{
  "id": "ASSESS-TC-REGEN-MODULE-001",
  "title": "Micropropagation and Fidelity Knowledge Check",
  "version": "1.0.0",
  "status": "approved",
  "purpose": "formative",
  "competencies": [
    "COMP-TC-REGEN-001"
  ],
  "objectives": [
    "LO-TC-MULTIPLY-001",
    "LO-TC-ROOT-002",
    "LO-TC-FIDELITY-003"
  ],
  "items": [
    "ITEM-TC-REGEN-001",
    "ITEM-TC-REGEN-002",
    "ITEM-TC-REGEN-003"
  ],
  "passingScorePercent": 80,
  "maxAttempts": null,
  "feedbackMode": "immediate"
}
