{
  "version": "1.0.0",
  "status": "draft",
  "competencies": [
    "COMP-SAFETY-WORK-001",
    "COMP-SPACE-BIOSEC-001",
    "COMP-PLANT-BIO-001",
    "COMP-ENV-VPD-001",
    "COMP-WATER-001",
    "COMP-NUTRITION-001",
    "COMP-ROOTZONE-001",
    "COMP-IPM-001",
    "COMP-PROP-001",
    "COMP-CANOPY-001",
    "COMP-FLOWER-001",
    "COMP-POSTHARVEST-001",
    "COMP-PRO-SOP-001",
    "COMP-PRO-QA-001",
    "COMP-CULT-TRACEABILITY-001",
    "COMP-CULT-EQUIPMENT-CARE-001"
  ],
  "objectives": [
    "LO-LH-TECH1-007-01",
    "LO-LH-TECH1-007-02",
    "LO-LH-TECH1-007-03",
    "LO-LH-TECH1-007-04",
    "LO-LH-TECH1-007-05",
    "LO-LH-TECH1-007-06"
  ],
  "passingScorePercent": 80,
  "randomizeItems": true,
  "randomizeChoices": true,
  "accommodations": {
    "allowExtendedTime": true,
    "allowAlternativeAccessiblePresentation": true
  },
  "id": "ASSESS-LH-TECH1-007-M01",
  "title": "Course 007 — Integrated Lab Readiness Check",
  "purpose": "formative",
  "items": [
    "ITEM-LH-TECH1-007-M01-001",
    "ITEM-LH-TECH1-007-M01-002",
    "ITEM-LH-TECH1-007-M01-003",
    "ITEM-LH-TECH1-007-M01-004",
    "ITEM-LH-TECH1-007-M01-005",
    "ITEM-LH-TECH1-007-M01-006",
    "ITEM-LH-TECH1-007-M01-007",
    "ITEM-LH-TECH1-007-M01-008",
    "ITEM-LH-TECH1-007-M01-009",
    "ITEM-LH-TECH1-007-M01-010",
    "ITEM-LH-TECH1-007-M01-011",
    "ITEM-LH-TECH1-007-M01-012"
  ],
  "maxAttempts": null,
  "feedbackMode": "immediate"
}
