{
  "id": "ASSESS-SOIL-BIO-MODULE-001",
  "title": "Media Chemistry and Soil Biology Knowledge Check",
  "version": "1.0.0",
  "status": "approved",
  "purpose": "formative",
  "competencies": [
    "COMP-SOIL-BIO-001"
  ],
  "objectives": [
    "LO-SOIL-CEC-001",
    "LO-SOIL-MICROBES-002",
    "LO-SOIL-AMENDMENTS-003"
  ],
  "items": [
    "ITEM-SOIL-BIO-001",
    "ITEM-SOIL-BIO-002",
    "ITEM-SOIL-BIO-003"
  ],
  "passingScorePercent": 80,
  "maxAttempts": null,
  "feedbackMode": "immediate"
}
