{
  "id": "ASSESS-ROOTZONE-ADVANCED-FINAL-001",
  "title": "THC Advanced Root Zone, Hydroponics and Soil Biology Final Assessment",
  "version": "1.0.0",
  "status": "draft",
  "purpose": "summative",
  "competencies": ["COMP-HYDRO-ADV-001", "COMP-SOIL-BIO-001"],
  "objectives": ["LO-HYDRO-SYSTEMS-001", "LO-HYDRO-SOLUTION-002", "LO-HYDRO-OXYGEN-003", "LO-SOIL-CEC-001", "LO-SOIL-MICROBES-002", "LO-SOIL-AMENDMENTS-003"],
  "items": ["ITEM-ROOTZONE-ADVANCED-FINAL-001", "ITEM-ROOTZONE-ADVANCED-FINAL-002", "ITEM-ROOTZONE-ADVANCED-FINAL-003", "ITEM-ROOTZONE-ADVANCED-FINAL-004", "ITEM-ROOTZONE-ADVANCED-FINAL-005", "ITEM-ROOTZONE-ADVANCED-FINAL-006", "ITEM-ROOTZONE-ADVANCED-FINAL-007", "ITEM-ROOTZONE-ADVANCED-FINAL-008", "ITEM-ROOTZONE-ADVANCED-FINAL-009", "ITEM-ROOTZONE-ADVANCED-FINAL-010", "ITEM-ROOTZONE-ADVANCED-FINAL-011", "ITEM-ROOTZONE-ADVANCED-FINAL-012"],
  "passingScorePercent": 80,
  "maxAttempts": 3,
  "cooldownHours": 0,
  "feedbackMode": "after-submit",
  "randomizeItems": true,
  "randomizeChoices": true,
  "extensions": {
    "courseFinalProfile": "public-noncredential-dedicated-bank",
    "sourceModuleAssessments": ["ASSESS-HYDRO-ADV-MODULE-001", "ASSESS-SOIL-BIO-MODULE-001"],
    "dedicatedItemBankSource": "preserved-from-prior-course-final-branches",
    "certificationUseStatus": "not-authorized",
    "academicThresholdStatus": "provisional-development",
    "standardSettingStatus": "pending-validation",
    "requireHumanAssessmentReview": true,
    "thresholdNote": "The 80% score is a development target for academic course completion only. This noncredential course final must not be used for certification issuance until review, pilot evidence, accessibility review, and release approval are recorded."
  }
}
