{
  "id": "ASSESS-CULT-TECH-II-CREDENTIAL-001",
  "title": "THC Cultivation Technician II Credential Examination",
  "version": "1.0.0",
  "status": "draft",
  "purpose": "credential",
  "totalItems": 90,
  "passingScorePercent": 80,
  "maxAttempts": 3,
  "cooldownHours": 24,
  "feedbackMode": "post-attempt-domain-level",
  "randomizeItems": true,
  "randomizeChoices": true,
  "competencies": [
    "COMP-ENV-ADV-001",
    "COMP-LIGHT-ADV-001",
    "COMP-WATER-QUALITY-ADV-001",
    "COMP-IRRIGATION-ADV-001",
    "COMP-NUTRIENT-DIAG-001",
    "COMP-IPM-ADV-001",
    "COMP-PROP-001",
    "COMP-CANOPY-ADV-001",
    "COMP-FLOWER-ADV-001",
    "COMP-POSTHARVEST-QA-001",
    "COMP-PRO-SOP-001",
    "COMP-PRO-QA-001",
    "COMP-CROP-PLAN-001"
  ],
  "objectives": [
    "LO-ENV-MAP-001",
    "LO-WATER-ALKALINITY-001",
    "LO-IRR-SCHEDULE-002",
    "LO-IPM-SCOUT-ADV-001",
    "LO-PROP-CLONE-003",
    "LO-CANOPY-ARCH-001",
    "LO-PH-DEVIATION-003",
    "LO-CROP-RECORDS-003",
    "LO-PRO-AUDIT-003",
    "LO-PRO-TRAIN-002"
  ],
  "itemPools": [
    {
      "name": "Multi-Factor Crop Diagnosis",
      "idPrefix": "ITEM-TECH2-DIAG-",
      "items": 8,
      "cognitiveTarget": "apply-analyze-evaluate"
    },
    {
      "name": "Sensors, Controls and Data Quality",
      "idPrefix": "ITEM-TECH2-SENSOR-",
      "items": 8,
      "cognitiveTarget": "apply-analyze-evaluate"
    },
    {
      "name": "Equipment Verification",
      "idPrefix": "ITEM-TECH2-EQUIP-",
      "items": 6,
      "cognitiveTarget": "apply-analyze-evaluate"
    },
    {
      "name": "Fertigation Batch Verification",
      "idPrefix": "ITEM-TECH2-FERT-",
      "items": 8,
      "cognitiveTarget": "apply-analyze-evaluate"
    },
    {
      "name": "Root-Zone and Irrigation Troubleshooting",
      "idPrefix": "ITEM-TECH2-ROOT-",
      "items": 8,
      "cognitiveTarget": "apply-analyze-evaluate"
    },
    {
      "name": "Advanced IPM Trend Interpretation",
      "idPrefix": "ITEM-TECH2-IPM-",
      "items": 8,
      "cognitiveTarget": "apply-analyze-evaluate"
    },
    {
      "name": "Propagation Performance Troubleshooting",
      "idPrefix": "ITEM-TECH2-PROP-",
      "items": 6,
      "cognitiveTarget": "apply-analyze-evaluate"
    },
    {
      "name": "Advanced Canopy and Flowering Execution",
      "idPrefix": "ITEM-TECH2-CANOPY-",
      "items": 6,
      "cognitiveTarget": "apply-analyze-evaluate"
    },
    {
      "name": "Postharvest Process Investigation",
      "idPrefix": "ITEM-TECH2-POST-",
      "items": 8,
      "cognitiveTarget": "apply-analyze-evaluate"
    },
    {
      "name": "Cultivation Deviation Investigation",
      "idPrefix": "ITEM-TECH2-DEV-",
      "items": 6,
      "cognitiveTarget": "apply-analyze-evaluate"
    },
    {
      "name": "Traceability and Inventory Reconciliation",
      "idPrefix": "ITEM-TECH2-TRACE-",
      "items": 6,
      "cognitiveTarget": "apply-analyze-evaluate"
    },
    {
      "name": "Production Metrics and Trend Review",
      "idPrefix": "ITEM-TECH2-METRIC-",
      "items": 7,
      "cognitiveTarget": "apply-analyze-evaluate"
    },
    {
      "name": "Peer Task Support and Handoff",
      "idPrefix": "ITEM-TECH2-PEER-",
      "items": 5,
      "cognitiveTarget": "apply-analyze-evaluate"
    }
  ],
  "itemSelection": {
    "minimumActiveItemsPerCompetency": 5,
    "targetBankItemsPerCompetency": 15,
    "requireReferenceBackedItems": true,
    "requireHumanAssessmentReview": true
  },
  "items": [],
  "accommodations": {
    "allowExtendedTime": true,
    "allowAlternativeAccessiblePresentation": true
  },
  "extensions": {
    "developmentBlueprintOnly": true,
    "operationalUseAuthorized": false,
    "publicRepositoryItemsMayBeUsedForOperationalCredentialForms": false,
    "secureOperationalItemBankRequired": true,
    "privateOperationalAssessmentStoreRequired": true,
    "secureEquivalentFormsRequired": true
  }
}
